{
  "$schema": "https://json-schema.org/draft/2020-12/schema",
  "$id": "behavior.schema.json",
  "title": "Behavior Record",
  "type": "object",
  "required": ["id", "summary", "source_services", "evidence", "confidence"],
  "properties": {
    "id":            { "type": "string", "pattern": "^BHV-[0-9]{4}$" },
    "summary":       { "type": "string", "minLength": 10 },
    "detail":        { "type": "string" },
    "source_services": { "type": "array", "items": { "type": "string" }, "minItems": 1 },
    "interfaces":    { "type": "array", "items": { "type": "string", "pattern": "^IFC-(SYNC|ASYNC)-[0-9]{4}$" } },
    "kind":          { "enum": ["validation", "calculation", "routing", "state-transition", "error-mapping", "side-effect", "emission", "other"] },
    "failure_path":  { "type": "boolean", "description": "True if this describes failure, timeout or partial-completion behavior. Under-represented by default; see 01-spec DR1." },
    "evidence":      { "$ref": "#/$defs/evidence" },
    "confidence":    { "enum": ["high", "medium", "low", "unknown"] },
    "reason":        { "type": "string", "description": "Required when confidence is unknown" },
    "agreement":     { "type": "object", "properties": {
                         "found_by": { "type": "array", "items": { "type": "string" } },
                         "k":        { "type": "integer" },
                         "score":    { "type": "number", "minimum": 0, "maximum": 1 } } },
    "context":       { "type": "string", "pattern": "^CTX-[0-9]{4}$" },
    "target_services": { "type": "array", "items": { "type": "string" } },
    "spec_clauses":  { "type": "array", "items": { "type": "string" } },
    "tests":         { "type": "array", "items": { "type": "string" } },
    "status":        { "enum": ["confirmed", "unconfirmed"], "default": "confirmed",
                       "description": "unconfirmed = present in an earlier run, not found in the latest. Never auto-deleted (REQ-31a)." },
    "last_seen_run": { "type": "integer" }
  },
  "$defs": {
    "evidence": {
      "type": "array", "minItems": 1,
      "items": {
        "type": "object",
        "required": ["source", "locator"],
        "properties": {
          "source":  { "enum": ["code", "test", "doc", "traffic", "stream-metadata", "commit-history", "config"] },
          "locator": { "type": "string", "description": "file:line, topic name, or query" },
          "excerpt": { "type": "string" }
        }
      }
    }
  }
}
